<?xml version="1.0" encoding="UTF-8"?>
<akt:Akt xmlns:akt="http://www.tim9.com/akt"
 xmlns:xsi="http://www.w3.org/2001/XMLSchema-instance"
 xsi:schemaLocation="http://www.tim9.com/akt file:/D:/7.%20SEMESTAR/XML/XML/Xml_web_services/XMLProject2016/data/akt_schema.xsd" id="QsX4" naslov="Flvkk74O7juF37KVn6soZjD5NZmpFF">
    <akt:Preambula>
        <akt:PravniOsnov>oRgGtL1R_Qxa</akt:PravniOsnov>
        <akt:NazivOrgana>pPXcm.I6Gck4vzLfoyseVIRY96FT_5</akt:NazivOrgana>
    </akt:Preambula>
    <akt:Clan id="h6y576y-_CM" naslov="wl" redniBroj="w-4TbCzt3Fz23eMYw">
        <akt:Stav id="RxKAWoVxiIwUZ-XtNVweQT">
            <akt:Sadrzaj>ZlQkRZPsdNw2oFfaWK40</akt:Sadrzaj>
        </akt:Stav>
        <akt:Stav id="vo.fijrqfz9.5TAG-nSVXHD1f">
            <akt:Tacka id="uG4aSVleiTqi-nJtMoz6s9tBn" redniBroj="utlIF0n5">
                <akt:Sadrzaj>antTh5ECm-eR</akt:Sadrzaj>
            </akt:Tacka>
            <akt:Tacka id="CgA_naTxbPXRQPcu8oS" redniBroj="JDUCRuE-N">
                <akt:Podtacka id="Pzr0" redniBroj="HYf7.tj4E.2Rlx_9LrEIy63E">
                    <akt:Sadrzaj>ebTuM52U-FG</akt:Sadrzaj>
                </akt:Podtacka>
                <akt:Podtacka id="Y3kz_dPJPKr0VSBR.WBTR1dC9cjPCt" redniBroj="A">
                    <akt:Sadrzaj>NcGU0z5WL0AjuJqSxs1</akt:Sadrzaj>
                </akt:Podtacka>
            </akt:Tacka>
        </akt:Stav>
    </akt:Clan>
    <akt:Clan id="_kjEajjMcbXkcYY" naslov="SGwAgSOjIbvw" redniBroj="URjpRrUjbelv2cqbdDowiqWv9aM">
        <akt:Stav id="AT4Oac6WnBHSOBIiZVkLKZw2aHiOh">
            <akt:Tacka id="OaiFkoEqPwlkmUyqoknIKw5q" redniBroj="QfO2.bg">
                <akt:Sadrzaj>G_yycFt.vicP</akt:Sadrzaj>
            </akt:Tacka>
            <akt:Tacka id="xA9Jjqqnog-Kx6RkIAkW6Q" redniBroj="ZDAmg7wHq257YgggI9067wXv-zu">
                <akt:Podtacka id="csaxcZdaDsh022hRFF4v4-Wk" redniBroj="JZqpgCm">
                    <akt:Sadrzaj>inT9NgxENtPc</akt:Sadrzaj>
                </akt:Podtacka>
                <akt:Podtacka id="u64R_q1cgf6md" redniBroj="D5Brcn.OrTqjl6o3G4qhowe_iBknT">
                    <akt:Sadrzaj>gxPx7A-H</akt:Sadrzaj>
                </akt:Podtacka>
            </akt:Tacka>
        </akt:Stav>
        <akt:Stav id="tK7b_w">
            <akt:Tacka id="T_blNo_E4xj2ZtgJcogU" redniBroj="cv4Rf2_G1mMy">
                <akt:Podtacka id="MRsDdiETB2ZH8Dialle0" redniBroj="Ou81QStw">
                    <akt:Alineja id="m.eYytaS">
                        <akt:Sadrzaj>F0NaMpJ.OHvmpY</akt:Sadrzaj>
                    </akt:Alineja>
                    <akt:Alineja id="NX_SGS7N8tvQ">
                        <akt:Sadrzaj>HQAxAWt-6OQ66Con.8k-m</akt:Sadrzaj>
                    </akt:Alineja>
                </akt:Podtacka>
                <akt:Podtacka id="TRNlu" redniBroj="Vb0oapS">
                    <akt:Sadrzaj>gB4v_1bhffspXzUXSWWq</akt:Sadrzaj>
                </akt:Podtacka>
            </akt:Tacka>
            <akt:Tacka id="LE3FH" redniBroj="j">
                <akt:Sadrzaj>zjtTwup</akt:Sadrzaj>
            </akt:Tacka>
        </akt:Stav>
    </akt:Clan>
</akt:Akt>
