<?xml version="1.0" encoding="UTF-8"?>
<Akt xmlns="http://www.tim9.com/akt"
 xmlns:xsi="http://www.w3.org/2001/XMLSchema-instance"
 xsi:schemaLocation="http://www.tim9.com/akt file:/E:/7.%20semestar/XML%20i%20veb%20servisi/Projekat/Projekat/Xml_web_services/XMLProject2016/data/akt_schema.xsd" id="id1" naslov="naslov1">
    <Preambula>
        <PravniOsnov>PravniOsnov0</PravniOsnov>
        <NazivOrgana>NazivOrgana0</NazivOrgana>
        <Oblast property="oblast" datatype="xs:string">Oblast0</Oblast>
        <Status property="status" datatype="xs:string">Status0</Status>
        <DatumPredaje property="datumPredaje" datatype="xs:date">2006-05-04</DatumPredaje>
        <DatumObjave property="datumObjave" datatype="xs:date">DatumObjave0</DatumObjave>
        <BrojGlasovaZa property="za" datatype="xs:date">0</BrojGlasovaZa>
        <BrojGlasovaProtiv property="protiv" datatype="xs:date">0</BrojGlasovaProtiv>
        <BrojGlasovaUzdrzano property="uzdrzano" datatype="xs:date">0</BrojGlasovaUzdrzano>
    </Preambula>
    <Deo id="id3" redniBroj="redniBroj1" naslov="naslov3">
        <Clan id="id5" naslov="naslov5" redniBroj="redniBroj3">
            <Stav id="id7">
                <Tacka id="id9" redniBroj="redniBroj5">
                    <Podtacka id="id11" redniBroj="redniBroj7">
                        <Sadrzaj>Sadrzaj0</Sadrzaj>
                    </Podtacka>
                    <Podtacka id="id13" redniBroj="redniBroj9">
                        <Sadrzaj>Sadrzaj1</Sadrzaj>
                    </Podtacka>
                </Tacka>
                <Tacka id="id15" redniBroj="redniBroj11">
                    <Podtacka id="id17" redniBroj="redniBroj13">
                        <Sadrzaj>Sadrzaj2</Sadrzaj>
                    </Podtacka>
                    <Podtacka id="id19" redniBroj="redniBroj15">
                        <Sadrzaj>Sadrzaj3</Sadrzaj>
                    </Podtacka>
                </Tacka>
            </Stav>
            <Stav id="id21">
                <Tacka id="id23" redniBroj="redniBroj17">
                    <Sadrzaj>Sadrzaj4</Sadrzaj>
                </Tacka>
                <Tacka id="id25" redniBroj="redniBroj19">
                    <Sadrzaj>Sadrzaj5</Sadrzaj>
                </Tacka>
            </Stav>
        </Clan>
        <Clan id="id27" naslov="naslov7" redniBroj="redniBroj21">
            <Stav id="id29">
                <Tacka id="id31" redniBroj="redniBroj23">
                    <Podtacka id="id33" redniBroj="redniBroj25">
                        <Alineja id="id35">
                            <Sadrzaj>Sadrzaj6</Sadrzaj>
                        </Alineja>
                        <Alineja id="id37">
                            <Sadrzaj>Sadrzaj7</Sadrzaj>
                        </Alineja>
                    </Podtacka>
                    <Podtacka id="id39" redniBroj="redniBroj27">
                        <Alineja id="id41">
                            <Sadrzaj>Sadrzaj8</Sadrzaj>
                        </Alineja>
                        <Alineja id="id43">
                            <Sadrzaj>Sadrzaj9</Sadrzaj>
                        </Alineja>
                    </Podtacka>
                </Tacka>
                <Tacka id="id45" redniBroj="redniBroj29">
                    <Sadrzaj>Sadrzaj10</Sadrzaj>
                </Tacka>
            </Stav>
            <Stav id="id47">
                <Sadrzaj>Sadrzaj11</Sadrzaj>
            </Stav>
        </Clan>
    </Deo>
    <Deo id="id49" redniBroj="redniBroj31" naslov="naslov9">
        <Clan id="id51" naslov="naslov11" redniBroj="redniBroj33">
            <Stav id="id53">
                <Tacka id="id55" redniBroj="redniBroj35">
                    <Podtacka id="id57" redniBroj="redniBroj37">
                        <Sadrzaj>Sadrzaj12</Sadrzaj>
                    </Podtacka>
                    <Podtacka id="id59" redniBroj="redniBroj39">
                        <Alineja id="id61">
                            <Sadrzaj>Sadrzaj13</Sadrzaj>
                        </Alineja>
                        <Alineja id="id63">
                            <Sadrzaj>Sadrzaj14</Sadrzaj>
                        </Alineja>
                    </Podtacka>
                </Tacka>
                <Tacka id="id65" redniBroj="redniBroj41">
                    <Podtacka id="id67" redniBroj="redniBroj43">
                        <Alineja id="id69">
                            <Sadrzaj>Sadrzaj15</Sadrzaj>
                        </Alineja>
                        <Alineja id="id71">
                            <Sadrzaj>Sadrzaj16</Sadrzaj>
                        </Alineja>
                    </Podtacka>
                    <Podtacka id="id73" redniBroj="redniBroj45">
                        <Alineja id="id75">
                            <Sadrzaj>Sadrzaj17</Sadrzaj>
                        </Alineja>
                        <Alineja id="id77">
                            <Sadrzaj>Sadrzaj18</Sadrzaj>
                        </Alineja>
                    </Podtacka>
                </Tacka>
            </Stav>
            <Stav id="id79">
                <Sadrzaj>Sadrzaj19</Sadrzaj>
            </Stav>
        </Clan>
        <Clan id="id81" naslov="naslov13" redniBroj="redniBroj47">
            <Stav id="id83">
                <Tacka id="id85" redniBroj="redniBroj49">
                    <Sadrzaj>Sadrzaj20</Sadrzaj>
                </Tacka>
                <Tacka id="id87" redniBroj="redniBroj51">
                    <Podtacka id="id89" redniBroj="redniBroj53">
                        <Alineja id="id91">
                            <Sadrzaj>Sadrzaj21</Sadrzaj>
                        </Alineja>
                        <Alineja id="id93">
                            <Sadrzaj>Sadrzaj22</Sadrzaj>
                        </Alineja>
                    </Podtacka>
                    <Podtacka id="id95" redniBroj="redniBroj55">
                        <Sadrzaj>Sadrzaj23</Sadrzaj>
                    </Podtacka>
                </Tacka>
            </Stav>
            <Stav id="id97">
                <Sadrzaj>Sadrzaj24</Sadrzaj>
            </Stav>
        </Clan>
    </Deo>
</Akt>
